{
  "object_id": "obj_demo_bam",
  "object_type": "pgo_aligned_reads",
  "schema_version": "1.0.0",
  "revision": 1,
  "created_at": "2026-09-17T13:00:00Z",
  "created_by": "pgp_variant_analysis",
  "input_refs": [
    {
      "object_id": "obj_demo_form_read_alignment",
      "revision": 1
    },
    {
      "object_id": "obj_demo_fastq",
      "revision": 1
    },
    {
      "object_id": "obj_demo_order",
      "revision": 1
    }
  ],
  "data": {
    "subject_id": "subject_demo_001",
    "order_ref": {
      "object_id": "obj_demo_order",
      "revision": 1
    },
    "reference_id": "PG_DEMO_REF_1",
    "profile_id": "pg_demo_small_variant_v1",
    "analysis_support": {
      "status": "sufficient",
      "evaluated_genes": [
        "PGGENE_A",
        "PGGENE_B",
        "PGGENE_C"
      ],
      "supported_variant_classes": [
        "SNV",
        "small_indel"
      ],
      "evidence": [
        {
          "kind": "synthetic_fixture_attestation",
          "reference": "demo-evidence-001",
          "summary": "Illustrative provider declaration for the fictional three-gene fixture; not a real measurement or clinical result."
        }
      ],
      "limitations": [
        "Synthetic fixture only; the native sample bytes do not establish real gene coverage or clinical validity."
      ]
    },
    "source_reads_ref": {
      "object_id": "obj_demo_fastq",
      "revision": 1
    },
    "sort_order": "coordinate",
    "alignment_count": 3,
    "index_present": true,
    "provenance": {
      "source_kind": "provider_generated",
      "source_label": "Synthetic provider-generated result for the Pocket Genes demonstration pipeline.",
      "producer_label": "Pocket Genes demo fixture author"
    }
  },
  "files": [
    {
      "role": "primary",
      "path": "payloads/demo.bam",
      "media_type": "application/octet-stream",
      "sha256": "7754c84562be6eda557639415b0fc5d4bcbf31c9475cc242b705fe0d5efa1b9d",
      "size_bytes": 321
    },
    {
      "role": "index",
      "path": "payloads/demo.bam.bai",
      "media_type": "application/octet-stream",
      "sha256": "f161f04d6028f5c142f8ddeb3cd3dfe72457c72dd238b17baf6597e29061b3ec",
      "size_bytes": 96
    }
  ]
}
